{
  "$schema": "http://json-schema.org/draft-07/schema#",
  "type": "object",
  "properties": {
    "name": {
      "type": "string",
      "minLength": 1
    },
    "trash_id": {
      "type": "string",
      "pattern": "^[a-fA-F0-9]{32}$"
    },
    "trash_description": {
      "type": "string",
      "minLength": 1
    },
    "info": {
      "type": "string",
      "minLength": 1,
      "description": "Optional markdown narrative rendered above this group's CF table by the render_profile_cfs macro (e.g. usage guidance)."
    },
    "default": {
      "type": "string",
      "enum": ["true", "false"]
    },
    "custom_formats": {
      "type": "array",
      "minItems": 1,
      "items": {
        "type": "object",
        "properties": {
          "name": {
            "type": "string",
            "minLength": 1
          },
          "trash_id": {
            "type": "string",
            "pattern": "^[a-fA-F0-9]{32}$"
          },
          "required": {
            "type": "boolean"
          },
          "default": {
            "type": "boolean"
          }
        },
        "required": ["name", "trash_id", "required"],
        "additionalProperties": false
      }
    },
    "quality_profiles": {
      "type": "object",
      "properties": {
        "include": {
          "type": "object",
          "patternProperties": {
            "^.+$": {
              "type": "string",
              "pattern": "^[a-fA-F0-9]{32}$"
            }
          },
          "additionalProperties": false,
          "minProperties": 1
        }
      },
      "required": ["include"],
      "additionalProperties": false
    }
  },
  "required": ["name", "trash_id", "custom_formats", "quality_profiles"],
  "additionalProperties": false
}
