{
    "name": "[Optional] German Miscellaneous",
    "trash_id": "9dc92ec4b41b7f38c8e7ecaf7d9dd9bc",
    "trash_description": "Optional Custom Formats: be sure to read the individual descriptions in the guide before adding all of them.",
    "custom_formats": [
        {
            "name": "German 1080p Booster",
            "trash_id": "3bc8df3a71baaac60a31ef696ea72d36",
            "required": false
        },
        {
            "name": "German 2160p Booster",
            "trash_id": "cc7b1e64e2513a6a271090cdfafaeb55",
            "required": false
        },
        {
            "name": "German Subbed",
            "trash_id": "ee425f921dd740621523343bffe82fa3",
            "required": false
        }
    ],
    "quality_profiles": {
        "include": {
            "Base Profile": "92e9a65a52ae48478fb8e9f34238d823"
        }
    }
}
