{
  "name": "[Optional] Golden Rule UHD",
  "trash_id": "ff204bbcecdd487d1cefcefdbf0c278d",
  "trash_description": "- x265 (HD): This blocks 720/1080p (HD) releases that are encoded in x265<br>- x265 (no HDR/DV): This blocks 720/1080p (HD) releases that are encoded in x265, But it will allow 720/1080p x265 releases if they have HDR and/or DV.<br><br><b>Please ensure you only score or enable one of them in your Quality Profile!!!</b>",
  "custom_formats": [
    {
      "name": "x265 (HD)",
      "trash_id": "dc98083864ea246d05a42df0d05f81cc",
      "required": false
    },
    {
      "name": "x265 (no HDR/DV)",
      "trash_id": "839bea857ed2c0a8e084f3cbdbd65ecb",
      "required": false,
      "default": true
    }
  ],
  "quality_profiles": {
    "include": {
      "Remux + WEB 2160p": "fd161a61e3ab826d3a22d53f935696dd",
      "Remux 2160p (Alternative)": "dd3cd75deb9645bae838d1c5da6388d5",
      "Remux 2160p (Combined)": "d1d310673359205736b4b84acd5ea8c8",
      "UHD Bluray + WEB": "64fb5f9858489bdac2af690e27c8f42f",
      "WEB 2160p": "0537bd27bcf8da604f30a862343b1742",
      "WEBDL 2160p (Combined)": "05fbf054ac8ad0303335026cc2632f1a",
      "[French MULTi.VO] UHD Bluray + WEB": "92ead7022d13a7858d54e328e6a2f8f9",
      "[French MULTi.VO] UHD Remux (2160p)": "1fef28c8c919f31cd86283b1baf527d4",
      "[French MULTi.VF] UHD Bluray + WEB": "e64b266178c7f70e208f493f00e0e50a",
      "[French MULTi.VF] UHD Remux (2160p)": "595bb95c6b6970468880069dce23e1d2",
      "[French VOSTFR] UHD Bluray + WEB": "525bf0513e2ac22fe116e8d7bec0a6b5",
      "[French VOSTFR] UHD Remux (2160p)": "9b32fc61d8ec83ed131f50f1db80505a",
      "[German] Remux + WEB 2160p": "79faa9943cef2f510b997b1f2a9f3ea6",
      "[German] UHD Bluray + WEB": "27cc3d153c0a799fd139ef1ff4c4cc42",
      "[German] UHD Bluray + WEB (Alternative)": "425da1ba30711b55d2eb371437ec98d7",
      "[SQP] SQP-2": "c3933358ba2356bafc41524f81471069",
      "[SQP] SQP-3": "2cf36c1f0106ffac993be003ade51865",
      "[SQP] SQP-3 (Audio)": "0ada8e60cc3ddf2733b65de10f4a6c72",
      "[SQP] SQP-4": "013f89e6da27519fe56cf482702a2db9",
      "[SQP] SQP-4 (MA Hybrid)": "7526db7ac0a1f764793fb181864d0222",
      "[SQP] SQP-5": "a7bb1539fd147256b21b1098f3dc2016",
      "Base Profile": "92e9a65a52ae48478fb8e9f34238d823"
    }
  }
}
