{
    "name": "[Unwanted] Unwanted Formats",
    "trash_id": "59c3af66780d08332fdc64e68297098f",
    "trash_description": "A list of unwanted release groups, versions, or sources: make sure to read the individual descriptions in the guide before adding any of them.",
    "default": "true",
    "custom_formats": [
        {
            "name": "AV1",
            "trash_id": "15a05bc7c1a36e2b57fd628f8977e2fc",
            "required": false,
            "default": true
        },
        {
            "name": "Bad Dual Groups",
            "trash_id": "32b367365729d530ca1c124a0b180c64",
            "required": false,
            "default": true
        },
        {
            "name": "BR-DISK",
            "trash_id": "85c61753df5da1fb2aab6f2a47426b09",
            "required": false,
            "default": true
        },
        {
            "name": "BR-DISK (BTN)",
            "trash_id": "6f808933a71bd9666531610cb8c059cc",
            "required": false
        },
        {
            "name": "BW",
            "trash_id": "21d9d08e39b05523ec36811ab06b8308",
            "required": false
        },
        {
            "name": "Extras",
            "trash_id": "fbcb31d8dabd2a319072b84fc0b7249c",
            "required": false,
            "default": true
        },
        {
            "name": "LQ",
            "trash_id": "9c11cd3f07101cdba90a2d81cf0e56b4",
            "required": false,
            "default": true
        },
        {
            "name": "LQ (Release Title)",
            "trash_id": "e2315f990da2e2cbfc9fa5b7a6fcfe48",
            "required": false,
            "default": true
        },
        {
            "name": "No-RlsGroup",
            "trash_id": "82d40da2bc6923f41e14394075dd4b03",
            "required": false
        },
        {
            "name": "Obfuscated",
            "trash_id": "e1a997ddb54e3ecbfe06341ad323c458",
            "required": false
        },
        {
            "name": "Retags",
            "trash_id": "06d66ab109d4d2eddb2794d21526d140",
            "required": false
        },
        {
            "name": "Scene",
            "trash_id": "1b3994c551cbb92a2c781af061f4ab44",
            "required": false
        },
        {
            "name": "Upscaled",
            "trash_id": "23297a736ca77c0fc8e70f8edd7ee56c",
            "required": false,
            "default": true
        }
    ],
    "quality_profiles": {
        "include": {
            "Remux + WEB 1080p": "fe9470e577c300a5ad9a3274f6d1cdf2",
            "Remux + WEB 2160p": "76a5053bdb2d1e4a8f16a69a37d46c12",
            "WEB-1080p": "72dae194fc92bf828f32cde7744e51a1",
            "Remux 2160p (Alternative)": "361717d531db5a6002e0f547ace46551",
            "Remux 2160p (Combined)": "911df0e05a395c19d8b3efc76a7467c1",
            "WEB-1080p (Alternative)": "9d142234e45d6143785ac55f5a9e8dc9",
            "WEB-2160p": "d1498e7d189fbe6c7110ceaabb7473e6",
            "WEB-2160p (Alternative)": "dfa5eaae7894077ad6449169b6eb03e0",
            "WEB-2160p (Combined)": "c4cadd6b35b95f62c3d47a408e53e2f7",
            "Base Profile": "e58cf4e090184db3b3d7c79c1a9e9b4a"
        }
    }
}
