{
    "name": "[Unwanted] Unwanted Formats",
    "trash_id": "a3ac6af01d78e4f21fcb75f601ac96df",
    "trash_description": "A list of unwanted release groups, versions, or sources: make sure to read the individual descriptions in the guide before adding any of them.",
    "default": "true",
    "custom_formats": [
        {
            "name": "3D",
            "trash_id": "b8cd450cbfa689c0259a01d9e29ba3d6",
            "required": false,
            "default": true
        },
        {
            "name": "AV1",
            "trash_id": "cae4ca30163749b891686f95532519bd",
            "required": false,
            "default": true
        },
        {
            "name": "Bad Dual Groups",
            "trash_id": "b6832f586342ef70d9c128d40c07b872",
            "required": false,
            "default": true
        },
        {
            "name": "Black and White Editions",
            "trash_id": "cc444569854e9de0b084ab2b8b1532b2",
            "required": false,
            "default": true
        },
        {
            "name": "BR-DISK",
            "trash_id": "ed38b889b31be83fda192888e2286d83",
            "required": false,
            "default": true
        },
        {
            "name": "Extras",
            "trash_id": "0a3f082873eb454bde444150b70253cc",
            "required": false,
            "default": true
        },
        {
            "name": "Generated Dynamic HDR",
            "trash_id": "e6886871085226c3da1830830146846c",
            "required": false,
            "default": true
        },
        {
            "name": "Line/Mic Dubbed",
            "trash_id": "c465ccc73923871b3eb1802042331306",
            "required": false,
            "default": true
        },
        {
            "name": "LQ",
            "trash_id": "90a6f9a284dff5103f6346090e6280c8",
            "required": false,
            "default": true
        },
        {
            "name": "LQ (Release Title)",
            "trash_id": "e204b80c87be9497a8a6eaff48f72905",
            "required": false,
            "default": true
        },
        {
            "name": "No-RlsGroup",
            "trash_id": "ae9b7c9ebde1f3bd336a8cbd1ec4c5e5",
            "required": false
        },
        {
            "name": "Obfuscated",
            "trash_id": "7357cf5161efbf8c4d5d0c30b4815ee2",
            "required": false
        },
        {
            "name": "Retags",
            "trash_id": "5c44f52a8714fdd79bb4d98e2673be1f",
            "required": false
        },
        {
            "name": "Scene",
            "trash_id": "f537cf427b64c38c8e36298f657e4828",
            "required": false
        },
        {
            "name": "Sing-Along Versions",
            "trash_id": "712d74cd88bceb883ee32f773656b1f5",
            "required": false,
            "default": true
        },
        {
            "name": "Upscaled",
            "trash_id": "bfd8eb01832d646a0a89c4deb46f8564",
            "required": false,
            "default": true
        }
    ],
    "quality_profiles": {
        "include": {
            "HD Bluray + WEB": "d1d67249d3890e49bc12e275d989a7e9",
            "Remux + WEB 1080p": "9ca12ea80aa55ef916e3751f4b874151",
            "Remux + WEB 2160p": "fd161a61e3ab826d3a22d53f935696dd",
            "UHD Bluray + WEB": "64fb5f9858489bdac2af690e27c8f42f",
            "WEB 1080p": "e8c5acb741363a0dbda67d3978f4912f",
            "WEB 2160p": "0537bd27bcf8da604f30a862343b1742",
            "WEBDL 2160p (Combined)": "05fbf054ac8ad0303335026cc2632f1a",
            "Remux 2160p (Alternative)": "dd3cd75deb9645bae838d1c5da6388d5",
            "Remux 2160p (Combined)": "d1d310673359205736b4b84acd5ea8c8",
            "Base Profile": "92e9a65a52ae48478fb8e9f34238d823"
        }
    }
}
